{
  "case_id": "BUILTUP-EXAMPLE-001",
  "standard": "СП 16.13330.2017",
  "action": "built_up_axial_members",
  "clause_7_2_applicability_confirmed": true,
  "axial_force_n": 800000.0,
  "total_net_area_mm2": 4800.0,
  "gross_area_mm2": 5000.0,
  "design_yield_resistance_n_mm2": 355.0,
  "design_ultimate_resistance_n_mm2": 485.0,
  "ultimate_resistance_safety_factor": 1.3,
  "working_condition_factor": 1.0,
  "elastic_modulus_n_mm2": 206000.0,
  "equation_5_resistance_branch": "yield",
  "panel_count": 8,
  "connector_system": "lattice",
  "whole_member_slenderness_y": 45.0,
  "whole_member_max_slenderness": 50.0,
  "branch_slenderness_1": 20.0,
  "branch_slenderness_2": 22.0,
  "branch_slenderness_3": 18.0,
  "branch_inertia_axis_1_mm4": 2000000.0,
  "branch_inertia_axis_2_mm4": 2200000.0,
  "branch_inertia_axis_3_mm4": 1800000.0,
  "branch_axis_spacing_b_mm": 400.0,
  "branch_axis_spacing_b1_mm": 350.0,
  "branch_axis_spacing_b2_mm": 450.0,
  "batten_inertia_mm4": 8000000.0,
  "batten_inertia_plane_1_mm4": 8000000.0,
  "batten_inertia_plane_2_mm4": 8500000.0,
  "batten_pitch_mm": 1000.0,
  "panel_length_mm": 1000.0,
  "diagonal_area_plane_1_mm2": 500.0,
  "diagonal_area_plane_2_mm2": 550.0,
  "diagonal_area_one_face_mm2": 500.0,
  "diagonal_length_d_mm": 600.0,
  "diagonal_length_d1_mm": 600.0,
  "diagonal_length_d2_mm": 650.0,
  "batten_branch_relative_slenderness": 1.2,
  "lattice_branch_relative_slenderness": 3.0,
  "clause_7_2_5_check_performed": true,
  "branch_section_type": "b",
  "connection_spacing_mm": 300.0,
  "selected_radius_of_gyration_mm": 10.0,
  "close_contact_force_state": "compression",
  "intermediate_connection_count": 2,
  "fictitious_shear_distribution_mode": "connectors_only",
  "connector_system_count": 2,
  "lattice_force_coefficient_alpha_1": 0.5,
  "one_branch_force_n": 200000.0,
  "one_diagonal_area_mm2": 500.0,
  "one_branch_area_mm2": 2500.0,
  "column_branch_force_1_n": 350000.0,
  "column_branch_force_2_n": 450000.0
}
